X,Y,ID,Description
530709,-12455676.5219837,3979205.6490812,Right lane closed on E Frank Lloyd Wright Blvd Westbound from N Pima Rd  to  N Hayden Rd . 1 Right lane closed.   10/11/2025 5:00 AM  to 10/11/2025 5:00 PM  
530712,-12456415.0224468,3982048.94281546,Exit ramp closed on  ramp  from 101-LOOP Eastbound  to  N Pima Rd . All lanes closed.   10/13/2025 10:00 PM  to 10/15/2025 5:00 AM  
530716,-12455611.980759,3977787.48697807,Parallel/frontage roadway closed on N Pima Rd Northbound from E Raintree Dr  to  E Frank Lloyd Wright Blvd . All lanes closed.   10/15/2025 10:00 PM  to 10/16/2025 6:00 AM  
530718,-12455651.4842811,3980541.74029365,Parallel/frontage roadway closed on N Pima Rd Southbound from E Bell Rd  to  E Frank Lloyd Wright Blvd . All lanes closed.   10/16/2025 10:00 PM  to 10/17/2025 6:00 AM  
530721,-12455662.0702368,3972913.89182518,Right lanes closed on 101-LOOP Northbound from E Shea Blvd (MP 41)  to  Princess Dr (MP 37) . 2 Right Lanes Closed.   10/27/2025 10:00 PM  to 10/31/2025 5:00 AM  
530722,-12455878.8344601,3981445.84338288,Right lanes closed on 101-LOOP Southbound from N Pima Rd (MP 37)  to  Shea Blvd (MP 41) . 2 Right Lanes Closed.   11/3/2025 10:00 PM  to 11/7/2025 5:00 AM  
530790,-12436475.3630021,3957378.49538174,AZTech.Mesa-4958 E Mcdowell - road construction - Westbound right lane closure on McDowell for Hylan West to replace cell site pole. For Boldyn networks.
530791,-12430493.9012796,3933221.08428159,AZTech.Mesa-8017 E Pecos - road construction - Eastbound and westbound lane shifts on Pecos for Nesbit to install new ADA ramps for the City of Mesa.
530821,-12432607.1229509,3958644.50279622,Turning lane closed on N Power Rd Southbound from E Eagle Crest Dr  to  202-LOOP Westbound . 1 Right lane closed.   9/29/2025 6:00 AM  to 10/11/2025 5:00 PM  
530828,-12432587.0854425,3958487.29391647,On ramp restricted on  ramp  from N Power Rd  to  202-LOOP Northbound . 1 Right lane closed.   9/29/2025 6:00 AM  to 10/11/2025 5:00 PM  
530833,-12432252.3043267,3947618.47100518,AZTech.Mesa-7205 E Southern - road construction - Alternating lane restrictions on Southern for Northstar Communications to install Google Fiber.
530856,-12432589.2859057,3958348.72210056,Turning lane closed on N Power Rd Northbound from E Preston St  to  202-LOOP Northbound . 1 Lane Closed.   9/29/2025 6:00 AM  to 10/11/2025 5:00 PM  
530969,-12319512.1975989,3774865.96910744,USE CAUTION: FLOODING OLD SPANISH TR WEST OF S X9 RANCH RD   WESTBOUND - Old Spanish Tr west of S X9 Ranch Rd  Westbound.  Status: Proceed with Caution due to FloodingFor more information please contact Pima County Community Relations at (520) 724-6410
